{
  "schemaVersion": 1,
  "id": "wcag-2-2-public-registry",
  "visibility": "public",
  "scope": "DEMO-289 evaluated every canonical public HTML page and every state in config/site-audit-states.json in English and Arabic; criterion statuses are bounded self-evaluation results, not a WCAG conformance claim.",
  "statusDefinitions": {
    "pass": "Self-evaluated as satisfied for the documented current scope with implementation, governing documentation, and current evidence; no framework-level conformance is asserted.",
    "partial": "Meaningful implementation or evidence exists, but criterion-specific scope, manual evaluation, operating evidence, freshness, or another material part remains incomplete.",
    "gap": "Criterion-specific implementation or evaluation has a known failure or missing requirement.",
    "not-applicable": "Triggering content or behavior is absent from documented current scope; reassess applicability when scope changes."
  },
  "validationDefinitions": {
    "automated": "partial means bounded axe-core evidence only; none means no criterion-specific automated accessibility determination is registered.",
    "manual": "required identifies criteria that still need criterion-appropriate human or real assistive-technology verification; DEMO-289 records only manual procedures actually executed and leaves real screen-reader testing unclaimed."
  },
  "sources": {
    "normative": "https://www.w3.org/TR/WCAG22/",
    "machineReadable": "https://www.w3.org/WAI/WCAG22/wcag.json",
    "conformanceUnderstanding": "https://www.w3.org/WAI/WCAG22/Understanding/conformance.html",
    "techniquesUnderstanding": "https://www.w3.org/WAI/WCAG22/Understanding/understanding-techniques.html",
    "retrievedDate": "2026-09-17",
    "attribution": "Criterion IDs, names, and levels come from W3C WCAG 2.2; implementation/evidence annotations are WizardGang metadata."
  },
  "freshnessRules": {
    "release-bound": "Reassess before a tagged release when accessibility-relevant code or evidence changes.",
    "content-change": "Reassess when public text, images, media, language, generated content, or document structure changes.",
    "interaction-change": "Reassess when focus, keyboard, pointer, authentication, form, timing, status-message, or other interaction behavior changes.",
    "quarterly-manual": "Repeat the documented manual browser and assistive-technology review at least every 90 days."
  },
  "registryRelationships": [
    {
      "relation": "evidence",
      "from": {
        "source": "github.structured-records.compliance.wcag-2.2",
        "native": "wcag-2-2-public-registry"
      },
      "to": {
        "source": "github.structured-records.evidence",
        "native": "EVD-TST-003"
      }
    },
    {
      "relation": "evidence",
      "from": {
        "source": "github.structured-records.compliance.wcag-2.2",
        "native": "wcag-2-2-public-registry"
      },
      "to": {
        "source": "github.structured-records.evidence",
        "native": "EVD-CI-001"
      }
    },
    {
      "relation": "evidence",
      "from": {
        "source": "github.structured-records.compliance.wcag-2.2",
        "native": "wcag-2-2-public-registry"
      },
      "to": {
        "source": "github.structured-records.evidence",
        "native": "EVD-TST-004"
      }
    },
    {
      "relation": "evidence",
      "from": {
        "source": "github.structured-records.compliance.wcag-2.2",
        "native": "wcag-2-2-public-registry"
      },
      "to": {
        "source": "github.structured-records.evidence",
        "native": "EVD-DOC-007"
      }
    }
  ]
}
